{
  "id": "R4e",
  "mip": {
    "commit": "b147c627e1bb15b5d15cc73cf30c2a36afd34dbb",
    "testId": "R4"
  },
  "normative": true,
  "description": "valType 255 (reserved): key \"x\", valType ff, valLen 0.",
  "event": {
    "type": "Misc",
    "name_hex": "6d69702d303031383a746f6b656e2d6d657461646174615b76315d0000000000",
    "payload_hex": "1111111111111111111111111111111111111111111111111111111111111111030178ff00000000000000000000000000000000000000000000000000000000000000000000000000000000000000000000000000000000000000000000000000000000000000000000000000000000000000000000000000000000000000000000000000000000000000000000000000000000000000000000000000000000000000000000000000000000000000000000000000000000000000000000000000000000000000000000000000000000000000000000000000000000000000000000000000000000000000000000000000000000000000000000000000000000",
    "payload_file": "R4e.bin"
  },
  "expect": {
    "result": "reject",
    "reason": "reserved-valtype",
    "offset": 33
  }
}
