{
  "id": "R2c",
  "mip": {
    "commit": "b147c627e1bb15b5d15cc73cf30c2a36afd34dbb",
    "testId": "R2"
  },
  "normative": true,
  "description": "A 222-byte key ends exactly at byte 256: the type byte would be at 256 (past the payload).",
  "event": {
    "type": "Misc",
    "name_hex": "6d69702d303031383a746f6b656e2d6d657461646174615b76315d0000000000",
    "payload_hex": "111111111111111111111111111111111111111111111111111111111111111103de6b6b6b6b6b6b6b6b6b6b6b6b6b6b6b6b6b6b6b6b6b6b6b6b6b6b6b6b6b6b6b6b6b6b6b6b6b6b6b6b6b6b6b6b6b6b6b6b6b6b6b6b6b6b6b6b6b6b6b6b6b6b6b6b6b6b6b6b6b6b6b6b6b6b6b6b6b6b6b6b6b6b6b6b6b6b6b6b6b6b6b6b6b6b6b6b6b6b6b6b6b6b6b6b6b6b6b6b6b6b6b6b6b6b6b6b6b6b6b6b6b6b6b6b6b6b6b6b6b6b6b6b6b6b6b6b6b6b6b6b6b6b6b6b6b6b6b6b6b6b6b6b6b6b6b6b6b6b6b6b6b6b6b6b6b6b6b6b6b6b6b6b6b6b6b6b6b6b6b6b6b6b6b6b6b6b6b6b6b6b6b6b6b6b6b6b6b6b6b6b6b6b6b6b6b6b6b6b6b6b6b6b6b6b6b6b6b6b6b6b6b6b",
    "payload_file": "R2c.bin"
  },
  "expect": {
    "result": "reject",
    "reason": "valtype-out-of-bounds",
    "offset": 33
  }
}
