{
  "id": "I3",
  "mip": {
    "commit": "b147c627e1bb15b5d15cc73cf30c2a36afd34dbb",
    "testId": "IGNORE"
  },
  "normative": true,
  "description": "An event of another MIP-0002 type (UnshieldedMint) is ignored even if its data bytes equal a valid MIP-0018 name and A1 payload.",
  "event": {
    "type": "UnshieldedMint",
    "name_hex": "6d69702d303031383a746f6b656e2d6d657461646174615b76315d0000000000",
    "payload_hex": "111111111111111111111111111111111111111111111111111111111111111103046e616d65010a41636d6520546f6b656e0673796d626f6c010441434d4508646563696d616c73020106097374616e646172647301086d69702d303030340000000000000000000000000000000000000000000000000000000000000000000000000000000000000000000000000000000000000000000000000000000000000000000000000000000000000000000000000000000000000000000000000000000000000000000000000000000000000000000000000000000000000000000000000000000000000000000000000000000000000000000000000000000000",
    "payload_file": "I3.bin"
  },
  "expect": {
    "result": "ignore",
    "reason": "not-misc"
  }
}
