{
  "id": "R1",
  "mip": {
    "commit": "b147c627e1bb15b5d15cc73cf30c2a36afd34dbb",
    "testId": "R1"
  },
  "normative": true,
  "description": "A header with no records: bytes 33..255 are all zero.",
  "event": {
    "type": "Misc",
    "name_hex": "6d69702d303031383a746f6b656e2d6d657461646174615b76315d0000000000",
    "payload_hex": "11111111111111111111111111111111111111111111111111111111111111110300000000000000000000000000000000000000000000000000000000000000000000000000000000000000000000000000000000000000000000000000000000000000000000000000000000000000000000000000000000000000000000000000000000000000000000000000000000000000000000000000000000000000000000000000000000000000000000000000000000000000000000000000000000000000000000000000000000000000000000000000000000000000000000000000000000000000000000000000000000000000000000000000000000000000",
    "payload_file": "R1.bin"
  },
  "expect": {
    "result": "reject",
    "reason": "no-records",
    "offset": 33
  }
}
