{
  "id": "I1a",
  "mip": {
    "commit": "b147c627e1bb15b5d15cc73cf30c2a36afd34dbb",
    "testId": "IGNORE"
  },
  "normative": true,
  "description": "A Misc event named mip-0018:token-metadata[v2] with the (valid) A1 payload is ignored, not accepted.",
  "event": {
    "type": "Misc",
    "name_hex": "6d69702d303031383a746f6b656e2d6d657461646174615b76325d0000000000",
    "payload_hex": "111111111111111111111111111111111111111111111111111111111111111103046e616d65010a41636d6520546f6b656e0673796d626f6c010441434d4508646563696d616c73020106097374616e646172647301086d69702d303030340000000000000000000000000000000000000000000000000000000000000000000000000000000000000000000000000000000000000000000000000000000000000000000000000000000000000000000000000000000000000000000000000000000000000000000000000000000000000000000000000000000000000000000000000000000000000000000000000000000000000000000000000000000000",
    "payload_file": "I1a.bin"
  },
  "expect": {
    "result": "ignore",
    "reason": "other-name"
  }
}
