{
  "id": "A5b",
  "mip": {
    "commit": "b147c627e1bb15b5d15cc73cf30c2a36afd34dbb",
    "testId": "A5"
  },
  "normative": true,
  "description": "Non-tombstones: empty bytes (type 0, key \"blob\") are an ordinary value.",
  "event": {
    "type": "Misc",
    "name_hex": "6d69702d303031383a746f6b656e2d6d657461646174615b76315d0000000000",
    "payload_hex": "111111111111111111111111111111111111111111111111111111111111111103046e616d65010441636d6504626c6f62000000000000000000000000000000000000000000000000000000000000000000000000000000000000000000000000000000000000000000000000000000000000000000000000000000000000000000000000000000000000000000000000000000000000000000000000000000000000000000000000000000000000000000000000000000000000000000000000000000000000000000000000000000000000000000000000000000000000000000000000000000000000000000000000000000000000000000000000000000",
    "payload_file": "A5b.bin"
  },
  "expect": {
    "result": "accept",
    "header": {
      "domainSep": "1111111111111111111111111111111111111111111111111111111111111111",
      "kind": 3
    },
    "records": [
      {
        "offset": 33,
        "key_hex": "6e616d65",
        "key_text": "name",
        "valType": 1,
        "value_hex": "41636d65",
        "value_text": "Acme"
      },
      {
        "offset": 44,
        "key_hex": "626c6f62",
        "key_text": "blob",
        "valType": 0,
        "value_hex": ""
      }
    ],
    "contentEnd": 51
  }
}
