{
  "id": "R6b",
  "mip": {
    "commit": "b147c627e1bb15b5d15cc73cf30c2a36afd34dbb",
    "testId": "R6"
  },
  "normative": true,
  "description": "A valid tombstone (Null at key \"retire\", 33..41) followed by an invalid record (valType 6, at 42).",
  "event": {
    "type": "Misc",
    "name_hex": "6d69702d303031383a746f6b656e2d6d657461646174615b76315d0000000000",
    "payload_hex": "11111111111111111111111111111111111111111111111111111111111111110306726574697265050001780600000000000000000000000000000000000000000000000000000000000000000000000000000000000000000000000000000000000000000000000000000000000000000000000000000000000000000000000000000000000000000000000000000000000000000000000000000000000000000000000000000000000000000000000000000000000000000000000000000000000000000000000000000000000000000000000000000000000000000000000000000000000000000000000000000000000000000000000000000000000000",
    "payload_file": "R6b.bin"
  },
  "expect": {
    "result": "reject",
    "reason": "reserved-valtype",
    "offset": 42
  }
}
