{
  "id": "R2b",
  "mip": {
    "commit": "b147c627e1bb15b5d15cc73cf30c2a36afd34dbb",
    "testId": "R2"
  },
  "normative": true,
  "description": "A 1-byte key with a 220-byte value: keyLen 1, key \"v\", valType 00, valLen 220 at 36; the value would end at 257.",
  "event": {
    "type": "Misc",
    "name_hex": "6d69702d303031383a746f6b656e2d6d657461646174615b76315d0000000000",
    "payload_hex": "111111111111111111111111111111111111111111111111111111111111111103017600dc787878787878787878787878787878787878787878787878787878787878787878787878787878787878787878787878787878787878787878787878787878787878787878787878787878787878787878787878787878787878787878787878787878787878787878787878787878787878787878787878787878787878787878787878787878787878787878787878787878787878787878787878787878787878787878787878787878787878787878787878787878787878787878787878787878787878787878787878787878787878787878787878787878",
    "payload_file": "R2b.bin"
  },
  "expect": {
    "result": "reject",
    "reason": "value-out-of-bounds",
    "offset": 33
  }
}
