{
  "id": "R5f",
  "mip": {
    "commit": "b147c627e1bb15b5d15cc73cf30c2a36afd34dbb",
    "testId": "R5"
  },
  "normative": true,
  "description": "An integer of 0 bytes: decimals, valType 2, valLen 0.",
  "event": {
    "type": "Misc",
    "name_hex": "6d69702d303031383a746f6b656e2d6d657461646174615b76315d0000000000",
    "payload_hex": "11111111111111111111111111111111111111111111111111111111111111110308646563696d616c7302000000000000000000000000000000000000000000000000000000000000000000000000000000000000000000000000000000000000000000000000000000000000000000000000000000000000000000000000000000000000000000000000000000000000000000000000000000000000000000000000000000000000000000000000000000000000000000000000000000000000000000000000000000000000000000000000000000000000000000000000000000000000000000000000000000000000000000000000000000000000000000",
    "payload_file": "R5f.bin"
  },
  "expect": {
    "result": "reject",
    "reason": "bad-integer-length",
    "offset": 33
  }
}
