{
  "id": "R4c",
  "mip": {
    "commit": "b147c627e1bb15b5d15cc73cf30c2a36afd34dbb",
    "testId": "R4"
  },
  "normative": true,
  "description": "kind 255 (byte 32) with otherwise valid A1 records.",
  "event": {
    "type": "Misc",
    "name_hex": "6d69702d303031383a746f6b656e2d6d657461646174615b76315d0000000000",
    "payload_hex": "1111111111111111111111111111111111111111111111111111111111111111ff046e616d65010a41636d6520546f6b656e0673796d626f6c010441434d4508646563696d616c73020106097374616e646172647301086d69702d303030340000000000000000000000000000000000000000000000000000000000000000000000000000000000000000000000000000000000000000000000000000000000000000000000000000000000000000000000000000000000000000000000000000000000000000000000000000000000000000000000000000000000000000000000000000000000000000000000000000000000000000000000000000000000",
    "payload_file": "R4c.bin"
  },
  "expect": {
    "result": "reject",
    "reason": "bad-kind",
    "offset": 32
  }
}
