{
  "id": "R5a",
  "mip": {
    "commit": "b147c627e1bb15b5d15cc73cf30c2a36afd34dbb",
    "testId": "R5"
  },
  "normative": true,
  "description": "Invalid UTF-8 in a type-1 value: \"Acme\" ff \"Token\".",
  "event": {
    "type": "Misc",
    "name_hex": "6d69702d303031383a746f6b656e2d6d657461646174615b76315d0000000000",
    "payload_hex": "111111111111111111111111111111111111111111111111111111111111111103046e616d65010a41636d65ff546f6b656e0000000000000000000000000000000000000000000000000000000000000000000000000000000000000000000000000000000000000000000000000000000000000000000000000000000000000000000000000000000000000000000000000000000000000000000000000000000000000000000000000000000000000000000000000000000000000000000000000000000000000000000000000000000000000000000000000000000000000000000000000000000000000000000000000000000000000000000000000000",
    "payload_file": "R5a.bin"
  },
  "expect": {
    "result": "reject",
    "reason": "invalid-utf8",
    "offset": 33
  }
}
