{
  "id": "A3c",
  "mip": {
    "commit": "b147c627e1bb15b5d15cc73cf30c2a36afd34dbb",
    "testId": "A3"
  },
  "normative": true,
  "description": "Exact bytes: a non-UTF-8 key (ff 6b 65 79) is accepted.",
  "event": {
    "type": "Misc",
    "name_hex": "6d69702d303031383a746f6b656e2d6d657461646174615b76315d0000000000",
    "payload_hex": "11111111111111111111111111111111111111111111111111111111111111110304ff6b657901026f6b00000000000000000000000000000000000000000000000000000000000000000000000000000000000000000000000000000000000000000000000000000000000000000000000000000000000000000000000000000000000000000000000000000000000000000000000000000000000000000000000000000000000000000000000000000000000000000000000000000000000000000000000000000000000000000000000000000000000000000000000000000000000000000000000000000000000000000000000000000000000000000000",
    "payload_file": "A3c.bin"
  },
  "expect": {
    "result": "accept",
    "header": {
      "domainSep": "1111111111111111111111111111111111111111111111111111111111111111",
      "kind": 3
    },
    "records": [
      {
        "offset": 33,
        "key_hex": "ff6b6579",
        "valType": 1,
        "value_hex": "6f6b",
        "value_text": "ok"
      }
    ],
    "contentEnd": 42
  }
}
