{
  "id": "R5c",
  "mip": {
    "commit": "b147c627e1bb15b5d15cc73cf30c2a36afd34dbb",
    "testId": "R5"
  },
  "normative": true,
  "description": "Invalid UTF-8 in a type-4 value: \"https://acme.example/\" followed by the overlong encoding c0 af.",
  "event": {
    "type": "Misc",
    "name_hex": "6d69702d303031383a746f6b656e2d6d657461646174615b76315d0000000000",
    "payload_hex": "11111111111111111111111111111111111111111111111111111111111111110303757269041768747470733a2f2f61636d652e6578616d706c652fc0af0000000000000000000000000000000000000000000000000000000000000000000000000000000000000000000000000000000000000000000000000000000000000000000000000000000000000000000000000000000000000000000000000000000000000000000000000000000000000000000000000000000000000000000000000000000000000000000000000000000000000000000000000000000000000000000000000000000000000000000000000000000000000000000000000000",
    "payload_file": "R5c.bin"
  },
  "expect": {
    "result": "reject",
    "reason": "invalid-utf8",
    "offset": 33
  }
}
