{
  "id": "I2a",
  "mip": {
    "commit": "b147c627e1bb15b5d15cc73cf30c2a36afd34dbb",
    "testId": "IGNORE"
  },
  "normative": true,
  "description": "A Misc event with another name (acme:token-metadata[v1]) and the A1 payload is ignored.",
  "event": {
    "type": "Misc",
    "name_hex": "61636d653a746f6b656e2d6d657461646174615b76315d000000000000000000",
    "payload_hex": "111111111111111111111111111111111111111111111111111111111111111103046e616d65010a41636d6520546f6b656e0673796d626f6c010441434d4508646563696d616c73020106097374616e646172647301086d69702d303030340000000000000000000000000000000000000000000000000000000000000000000000000000000000000000000000000000000000000000000000000000000000000000000000000000000000000000000000000000000000000000000000000000000000000000000000000000000000000000000000000000000000000000000000000000000000000000000000000000000000000000000000000000000000",
    "payload_file": "I2a.bin"
  },
  "expect": {
    "result": "ignore",
    "reason": "other-name"
  }
}
