{
  "id": "R5d",
  "mip": {
    "commit": "b147c627e1bb15b5d15cc73cf30c2a36afd34dbb",
    "testId": "R5"
  },
  "normative": true,
  "description": "Invalid JSON in a type-3 value: {\"name\":\"Acme\" (unterminated object).",
  "event": {
    "type": "Misc",
    "name_hex": "6d69702d303031383a746f6b656e2d6d657461646174615b76315d0000000000",
    "payload_hex": "111111111111111111111111111111111111111111111111111111111111111103046d657461030e7b226e616d65223a2241636d652200000000000000000000000000000000000000000000000000000000000000000000000000000000000000000000000000000000000000000000000000000000000000000000000000000000000000000000000000000000000000000000000000000000000000000000000000000000000000000000000000000000000000000000000000000000000000000000000000000000000000000000000000000000000000000000000000000000000000000000000000000000000000000000000000000000000000000000",
    "payload_file": "R5d.bin"
  },
  "expect": {
    "result": "reject",
    "reason": "invalid-json",
    "offset": 33
  }
}
