{
  "id": "A4b",
  "mip": {
    "commit": "b147c627e1bb15b5d15cc73cf30c2a36afd34dbb",
    "testId": "A4"
  },
  "normative": true,
  "description": "Integer widths: decimals as 06 followed by 15 zero bytes (Uint<128>, little-endian) decodes to 6.",
  "event": {
    "type": "Misc",
    "name_hex": "6d69702d303031383a746f6b656e2d6d657461646174615b76315d0000000000",
    "payload_hex": "11111111111111111111111111111111111111111111111111111111111111110308646563696d616c7302100600000000000000000000000000000000000000000000000000000000000000000000000000000000000000000000000000000000000000000000000000000000000000000000000000000000000000000000000000000000000000000000000000000000000000000000000000000000000000000000000000000000000000000000000000000000000000000000000000000000000000000000000000000000000000000000000000000000000000000000000000000000000000000000000000000000000000000000000000000000000000",
    "payload_file": "A4b.bin"
  },
  "expect": {
    "result": "accept",
    "header": {
      "domainSep": "1111111111111111111111111111111111111111111111111111111111111111",
      "kind": 3
    },
    "records": [
      {
        "offset": 33,
        "key_hex": "646563696d616c73",
        "key_text": "decimals",
        "valType": 2,
        "value_hex": "06000000000000000000000000000000",
        "decoded": "6"
      }
    ],
    "contentEnd": 60
  }
}
