{
  "id": "A3b",
  "mip": {
    "commit": "b147c627e1bb15b5d15cc73cf30c2a36afd34dbb",
    "testId": "A3"
  },
  "normative": true,
  "description": "Exact bytes: the type-0 value 01 00 00 keeps its trailing zeros (value length 3).",
  "event": {
    "type": "Misc",
    "name_hex": "6d69702d303031383a746f6b656e2d6d657461646174615b76315d0000000000",
    "payload_hex": "11111111111111111111111111111111111111111111111111111111111111110304646174610003010000000000000000000000000000000000000000000000000000000000000000000000000000000000000000000000000000000000000000000000000000000000000000000000000000000000000000000000000000000000000000000000000000000000000000000000000000000000000000000000000000000000000000000000000000000000000000000000000000000000000000000000000000000000000000000000000000000000000000000000000000000000000000000000000000000000000000000000000000000000000000000000",
    "payload_file": "A3b.bin"
  },
  "expect": {
    "result": "accept",
    "header": {
      "domainSep": "1111111111111111111111111111111111111111111111111111111111111111",
      "kind": 3
    },
    "records": [
      {
        "offset": 33,
        "key_hex": "64617461",
        "key_text": "data",
        "valType": 0,
        "value_hex": "010000"
      }
    ],
    "contentEnd": 43
  }
}
